13.8s 1 /kaggle/input/two-sigma-connect-rental-listing-inquiries/images_sample.zip
13.8s 2 /kaggle/input/two-sigma-connect-rental-listing-inquiries/Kaggle-renthop.torrent
13.8s 3 /kaggle/input/two-sigma-connect-rental-listing-inquiries/sample_submission.csv.zip
13.8s 4 /kaggle/input/two-sigma-connect-rental-listing-inquiries/test.json.zip
13.8s 5 /kaggle/input/two-sigma-connect-rental-listing-inquiries/train.json.zip
13.8s 6 /opt/conda/lib/python3.7/site-packages/papermill/iorw.py:50: FutureWarning: pyarrow.HadoopFileSystem is deprecated as of 2.0.0, please use pyarrow.fs.HadoopFileSystem instead.
13.8s 7 from pyarrow import HadoopFileSystem
23.0s 8 ['bathrooms' 'bedrooms' 'building_id' 'created' 'description'
23.0s 9 'display_address' 'features' 'latitude' 'listing_id' 'longitude'
23.0s 10 'manager_id' 'photos' 'price' 'street_address' 'interest_level']
23.2s 11 ['bathrooms' 'bedrooms' 'building_id' 'created' 'description'
23.2s 12 'display_address' 'features' 'latitude' 'listing_id' 'longitude'
23.2s 13 'manager_id' 'photos' 'price' 'street_address']
210.0s 14 <class 'pandas.core.frame.DataFrame'>
210.0s 15 Int64Index: 49352 entries, 4 to 124009
210.0s 16 Data columns (total 15 columns):
210.0s 17 #   Column           Non-Null Count  Dtype
210.0s 18 ---  ------           --------------  -----
210.0s 19 0   bathrooms        49352 non-null  float64
210.0s 20 1   bedrooms         49352 non-null  int64
210.0s 21 2   building_id      49352 non-null  object
210.0s 22 3   created          49352 non-null  object
210.0s 23 4   description      49352 non-null  object
210.0s 24 5   display_address  49352 non-null  object
210.0s 25 6   features         49352 non-null  object
210.0s 26 7   latitude         49352 non-null  float64
210.0s 27 8   listing_id       49352 non-null  int64
210.0s 28 9   longitude        49352 non-null  float64
210.0s 29 10  manager_id       49352 non-null  object
210.0s 30 11  photos           49352 non-null  object
210.0s 31 12  price            49352 non-null  int64
210.0s 32 13  street_address   49352 non-null  object
210.0s 33 14  interest_level   49352 non-null  object
210.0s 34 dtypes: float64(3), int64(3), object(9)
210.0s 35 memory usage: 6.0+ MB
210.2s 36 <class 'pandas.core.frame.DataFrame'>
210.2s 37 Int64Index: 74659 entries, 0 to 124010
210.2s 38 Data columns (total 14 columns):
210.2s 39 #   Column           Non-Null Count  Dtype
210.2s 40 ---  ------           --------------  -----
210.2s 41 0   bathrooms        74659 non-null  float64
210.2s 42 1   bedrooms         74659 non-null  int64
210.2s 43 2   building_id      74659 non-null  object
210.2s 44 3   created          74659 non-null  object
210.2s 45 4   description      74659 non-null  object
210.2s 46 5   display_address  74659 non-null  object
210.2s 47 6   features         74659 non-null  object
210.2s 48 7   latitude         74659 non-null  float64
210.2s 49 8   listing_id       74659 non-null  int64
210.2s 50 9   longitude        74659 non-null  float64
210.2s 51 10  manager_id       74659 non-null  object
210.2s 52 11  photos           74659 non-null  object
210.2s 53 12  price            74659 non-null  int64
210.2s 54 13  street_address   74659 non-null  object
210.2s 55 dtypes: float64(3), int64(3), object(8)
210.2s 56 memory usage: 8.5+ MB
219.2s 57 Number of Unique Display Addresses is 8826
220.6s 58 /opt/conda/lib/python3.7/site-packages/seaborn/regression.py:581: UserWarning: The `size` parameter has been renamed to `height`; please update your code.
220.6s 59 warnings.warn(msg, UserWarning)
225.6s 60 /opt/conda/lib/python3.7/site-packages/seaborn/distributions.py:2619: FutureWarning: `distplot` is a deprecated function and will be removed in a future version. Please adapt your code to use either `displot` (a figure-level function with similar flexibility) or `histplot` (an axes-level function for histograms).
225.6s 61 warnings.warn(msg, FutureWarning)
1173.0s 62 /opt/conda/lib/python3.7/site-packages/xgboost/sklearn.py:1224: UserWarning: The use of label encoder in XGBClassifier is deprecated and will be removed in a future release. To remove this warning, do the following: 1) Pass option use_label_encoder=False when constructing XGBClassifier object; and 2) Encode your labels (y) as integers starting with 0, i.e. 0, 1, 2, ..., [num_class - 1].
1173.0s 63 warnings.warn(label_encoder_deprecation_msg, UserWarning)
1173.3s 64 [10:47:59] WARNING: ../src/learner.cc:1115: Starting in XGBoost 1.3.0, the default evaluation metric used with the objective 'multi:softprob' was changed from 'merror' to 'mlogloss'. Explicitly set eval_metric if you'd like to restore the old behavior.
1373.4s 65 [10:51:18] WARNING: ../src/learner.cc:1115: Starting in XGBoost 1.3.0, the default evaluation metric used with the objective 'multi:softprob' was changed from 'merror' to 'mlogloss'. Explicitly set eval_metric if you'd like to restore the old behavior.
1578.9s 66 [10:54:44] WARNING: ../src/learner.cc:1115: Starting in XGBoost 1.3.0, the default evaluation metric used with the objective 'multi:softprob' was changed from 'merror' to 'mlogloss'. Explicitly set eval_metric if you'd like to restore the old behavior.
1784.1s 67 [10:58:09] WARNING: ../src/learner.cc:1115: Starting in XGBoost 1.3.0, the default evaluation metric used with the objective 'multi:softprob' was changed from 'merror' to 'mlogloss'. Explicitly set eval_metric if you'd like to restore the old behavior.
1987.1s 68 [11:01:32] WARNING: ../src/learner.cc:1115: Starting in XGBoost 1.3.0, the default evaluation metric used with the objective 'multi:softprob' was changed from 'merror' to 'mlogloss'. Explicitly set eval_metric if you'd like to restore the old behavior.
2189.8s 69 [32m[I 2022-01-31 11:04:55,773][0m A new study created in memory with name: no-name-8d7164c0-e478-45ea-8b1e-a6f44b7646a0[0m
2190.2s 70 [32m[I 2022-01-31 11:04:56,179][0m Trial 0 finished with value: 0.7041839732549894 and parameters: {'booster': 'gbtree', 'learning_rate': 0.016816083996815695, 'max_depth': 7, 'subsample': 0.4607074242149113, 'colsample_bytree': 0.5203592160246616}. Best is trial 0 with value: 0.7041839732549894.[0m
2190.3s 71 [32m[I 2022-01-31 11:04:56,277][0m Trial 1 finished with value: 0.6946611285584035 and parameters: {'booster': 'gblinear', 'learning_rate': 0.016752633577416142, 'max_depth': 10, 'subsample': 0.4930025951498269, 'colsample_bytree': 0.6388969927001121}. Best is trial 0 with value: 0.7041839732549894.[0m
2190.4s 72 [32m[I 2022-01-31 11:04:56,370][0m Trial 2 finished with value: 0.6946611285584035 and parameters: {'booster': 'gblinear', 'learning_rate': 0.021622300305822188, 'max_depth': 5, 'subsample': 0.8657587450520384, 'colsample_bytree': 0.8932983831997682}. Best is trial 0 with value: 0.7041839732549894.[0m
2190.4s 73 [11:04:56] WARNING: ../src/learner.cc:576:
2190.4s 74 Parameters: { "colsample_bytree", "max_depth", "subsample" } might not be used.
2190.4s 75 
2190.4s 76 This could be a false alarm, with some parameters getting used by language bindings but
2190.4s 77 then being mistakenly passed down to XGBoost core, or some parameter actually being used
2190.4s 78 but getting flagged wrongly here. Please open an issue if you find any such cases.
2190.4s 79 
2190.4s 80 
2190.4s 81 [11:04:56] WARNING: ../src/learner.cc:576:
2190.4s 82 Parameters: { "colsample_bytree", "max_depth", "subsample" } might not be used.
2190.4s 83 
2190.4s 84 This could be a false alarm, with some parameters getting used by language bindings but
2190.4s 85 then being mistakenly passed down to XGBoost core, or some parameter actually being used
2190.4s 86 but getting flagged wrongly here. Please open an issue if you find any such cases.
2190.4s 87 
2190.4s 88 
2190.5s 89 [32m[I 2022-01-31 11:04:56,483][0m Trial 3 finished with value: 0.6901023199270591 and parameters: {'booster': 'gbtree', 'learning_rate': 0.055477291514233605, 'max_depth': 5, 'subsample': 0.05180733377807778, 'colsample_bytree': 0.06732646640663287}. Best is trial 0 with value: 0.7041839732549894.[0m
2191.4s 90 [32m[I 2022-01-31 11:04:57,394][0m Trial 4 finished with value: 0.7168473305642791 and parameters: {'booster': 'dart', 'learning_rate': 0.03739154339584264, 'max_depth': 10, 'subsample': 0.6790166712525748, 'colsample_bytree': 0.7846419840384307}. Best is trial 4 with value: 0.7168473305642791.[0m
2191.7s 91 [32m[I 2022-01-31 11:04:57,670][0m Trial 5 finished with value: 0.699321244048222 and parameters: {'booster': 'gbtree', 'learning_rate': 0.013531763654789272, 'max_depth': 4, 'subsample': 0.9966815213289075, 'colsample_bytree': 0.7683847109124524}. Best is trial 4 with value: 0.7168473305642791.[0m
2192.0s 92 [32m[I 2022-01-31 11:04:57,903][0m Trial 6 finished with value: 0.6910140816533279 and parameters: {'booster': 'gbtree', 'learning_rate': 0.04648733303734314, 'max_depth': 5, 'subsample': 0.04466066246089484, 'colsample_bytree': 0.41536366516892}. Best is trial 4 with value: 0.7168473305642791.[0m
2192.2s 93 [32m[I 2022-01-31 11:04:58,144][0m Trial 7 finished with value: 0.7037787458210921 and parameters: {'booster': 'gbtree', 'learning_rate': 0.015544590117836828, 'max_depth': 5, 'subsample': 0.5321069992570016, 'colsample_bytree': 0.2857093551632274}. Best is trial 4 with value: 0.7168473305642791.[0m
2192.3s 94 [32m[I 2022-01-31 11:04:58,238][0m Trial 8 finished with value: 0.6939519805490831 and parameters: {'booster': 'gblinear', 'learning_rate': 0.040667837991969866, 'max_depth': 10, 'subsample': 0.2763702404024808, 'colsample_bytree': 0.53444591173745}. Best is trial 4 with value: 0.7168473305642791.[0m
2192.4s 95 [11:04:58] WARNING: ../src/learner.cc:576:
2192.4s 96 Parameters: { "colsample_bytree", "max_depth", "subsample" } might not be used.
2192.4s 97 
2192.4s 98 This could be a false alarm, with some parameters getting used by language bindings but
2192.4s 99 then being mistakenly passed down to XGBoost core, or some parameter actually being used
2192.4s 100 but getting flagged wrongly here. Please open an issue if you find any such cases.
2192.4s 101 
2192.4s 102 
2192.6s 103 [32m[I 2022-01-31 11:04:58,569][0m Trial 9 finished with value: 0.6953702765677237 and parameters: {'booster': 'gbtree', 'learning_rate': 0.05723463823325637, 'max_depth': 9, 'subsample': 0.31953313486045987, 'colsample_bytree': 0.3011706924356079}. Best is trial 4 with value: 0.7168473305642791.[0m
2193.8s 104 [32m[I 2022-01-31 11:04:59,741][0m Trial 10 finished with value: 0.7137068179515752 and parameters: {'booster': 'dart', 'learning_rate': 0.08686983443587303, 'max_depth': 8, 'subsample': 0.72726924129444, 'colsample_bytree': 0.9429842279562399}. Best is trial 4 with value: 0.7168473305642791.[0m
2195.1s 105 [32m[I 2022-01-31 11:05:01,096][0m Trial 11 finished with value: 0.713301590517678 and parameters: {'booster': 'dart', 'learning_rate': 0.09797238035754198, 'max_depth': 8, 'subsample': 0.7160464227581127, 'colsample_bytree': 0.9725462266571412}. Best is trial 4 with value: 0.7168473305642791.[0m
2195.8s 106 [32m[I 2022-01-31 11:05:01,724][0m Trial 12 finished with value: 0.7114780670651404 and parameters: {'booster': 'dart', 'learning_rate': 0.09994236948936672, 'max_depth': 7, 'subsample': 0.6953244831932381, 'colsample_bytree': 0.7954555994887951}. Best is trial 4 with value: 0.7168473305642791.[0m
2197.0s 107 [32m[I 2022-01-31 11:05:02,945][0m Trial 13 finished with value: 0.716746023705805 and parameters: {'booster': 'dart', 'learning_rate': 0.025056191417524153, 'max_depth': 11, 'subsample': 0.7099668797639777, 'colsample_bytree': 0.9906483532608308}. Best is trial 4 with value: 0.7168473305642791.[0m
2198.0s 108 [32m[I 2022-01-31 11:05:03,962][0m Trial 14 finished with value: 0.7179617060074968 and parameters: {'booster': 'dart', 'learning_rate': 0.026530279333619896, 'max_depth': 11, 'subsample': 0.8707676979174627, 'colsample_bytree': 0.7292511399361694}. Best is trial 14 with value: 0.7179617060074968.[0m
2199.0s 109 [32m[I 2022-01-31 11:05:04,945][0m Trial 15 finished with value: 0.713605511093101 and parameters: {'booster': 'dart', 'learning_rate': 0.010047708487860596, 'max_depth': 11, 'subsample': 0.9269865263407111, 'colsample_bytree': 0.6672209243922682}. Best is trial 14 with value: 0.7179617060074968.[0m
2199.9s 110 [32m[I 2022-01-31 11:05:05,840][0m Trial 16 finished with value: 0.7181643197244454 and parameters: {'booster': 'dart', 'learning_rate': 0.03129719142662247, 'max_depth': 10, 'subsample': 0.856854936738194, 'colsample_bytree': 0.7741808719608794}. Best is trial 16 with value: 0.7181643197244454.[0m
2200.8s 111 [32m[I 2022-01-31 11:05:06,781][0m Trial 17 finished with value: 0.7206969911863033 and parameters: {'booster': 'dart', 'learning_rate': 0.027862850259270034, 'max_depth': 11, 'subsample': 0.8361340618196477, 'colsample_bytree': 0.6544261270379697}. Best is trial 17 with value: 0.7206969911863033.[0m
2201.5s 112 [32m[I 2022-01-31 11:05:07,485][0m Trial 18 finished with value: 0.7104649984803972 and parameters: {'booster': 'dart', 'learning_rate': 0.031829365671375065, 'max_depth': 9, 'subsample': 0.809937742335901, 'colsample_bytree': 0.6132664622177427}. Best is trial 17 with value: 0.7206969911863033.[0m
2202.1s 113 [32m[I 2022-01-31 11:05:08,060][0m Trial 19 finished with value: 0.7099584641880254 and parameters: {'booster': 'dart', 'learning_rate': 0.021747763700980822, 'max_depth': 9, 'subsample': 0.6107939700231162, 'colsample_bytree': 0.39595636459834904}. Best is trial 17 with value: 0.7206969911863033.[0m
2202.4s 114 [32m[I 2022-01-31 11:05:08,376][0m Trial 20 finished with value: 0.7012460743592341 and parameters: {'booster': 'dart', 'learning_rate': 0.030703647408992774, 'max_depth': 3, 'subsample': 0.9888911053856757, 'colsample_bytree': 0.8349853669789817}. Best is trial 17 with value: 0.7206969911863033.[0m
2203.5s 115 [32m[I 2022-01-31 11:05:09,495][0m Trial 21 finished with value: 0.7187721608752913 and parameters: {'booster': 'dart', 'learning_rate': 0.02835020165399363, 'max_depth': 11, 'subsample': 0.8360036573631238, 'colsample_bytree': 0.6985151469312496}. Best is trial 17 with value: 0.7206969911863033.[0m
2204.5s 116 [32m[I 2022-01-31 11:05:10,490][0m Trial 22 finished with value: 0.7168473305642791 and parameters: {'booster': 'dart', 'learning_rate': 0.033600095124696555, 'max_depth': 11, 'subsample': 0.8134020837849061, 'colsample_bytree': 0.7010393361520336}. Best is trial 17 with value: 0.7206969911863033.[0m
2205.3s 117 [32m[I 2022-01-31 11:05:11,247][0m Trial 23 finished with value: 0.7152264208286903 and parameters: {'booster': 'dart', 'learning_rate': 0.022487388442912086, 'max_depth': 10, 'subsample': 0.8192251092073157, 'colsample_bytree': 0.5827753776664018}. Best is trial 17 with value: 0.7206969911863033.[0m
2206.4s 118 [32m[I 2022-01-31 11:05:12,325][0m Trial 24 finished with value: 0.7200891500354574 and parameters: {'booster': 'dart', 'learning_rate': 0.04781889816013865, 'max_depth': 11, 'subsample': 0.5895745720365367, 'colsample_bytree': 0.8550168431636536}. Best is trial 17 with value: 0.7206969911863033.[0m
2206.5s 119 [32m[I 2022-01-31 11:05:12,445][0m Trial 25 finished with value: 0.6905075473609563 and parameters: {'booster': 'gblinear', 'learning_rate': 0.056165837046626026, 'max_depth': 11, 'subsample': 0.5825294453026354, 'colsample_bytree': 0.8746175080141612}. Best is trial 17 with value: 0.7206969911863033.[0m
2206.6s 120 [11:05:12] WARNING: ../src/learner.cc:576:
2206.6s 121 Parameters: { "colsample_bytree", "max_depth", "subsample" } might not be used.
2206.6s 122 
2206.6s 123 This could be a false alarm, with some parameters getting used by language bindings but
2206.6s 124 then being mistakenly passed down to XGBoost core, or some parameter actually being used
2206.6s 125 but getting flagged wrongly here. Please open an issue if you find any such cases.
2206.6s 126 
2206.6s 127 
2207.0s 128 [32m[I 2022-01-31 11:05:12,941][0m Trial 26 finished with value: 0.7035761321041435 and parameters: {'booster': 'dart', 'learning_rate': 0.07237747326290347, 'max_depth': 8, 'subsample': 0.4094879370864877, 'colsample_bytree': 0.4474501448900152}. Best is trial 17 with value: 0.7206969911863033.[0m
2207.9s 129 [32m[I 2022-01-31 11:05:13,801][0m Trial 27 finished with value: 0.7184682402998683 and parameters: {'booster': 'dart', 'learning_rate': 0.043882782170657754, 'max_depth': 9, 'subsample': 0.63139482308429, 'colsample_bytree': 0.8877481094020055}. Best is trial 17 with value: 0.7206969911863033.[0m
2208.9s 130 [32m[I 2022-01-31 11:05:14,804][0m Trial 28 finished with value: 0.7140107385269983 and parameters: {'booster': 'dart', 'learning_rate': 0.048641296609155976, 'max_depth': 11, 'subsample': 0.7626340777402104, 'colsample_bytree': 0.7000600487841383}. Best is trial 17 with value: 0.7206969911863033.[0m
2209.0s 131 [32m[I 2022-01-31 11:05:14,916][0m Trial 29 finished with value: 0.6860500455880864 and parameters: {'booster': 'gblinear', 'learning_rate': 0.0685849020507887, 'max_depth': 6, 'subsample': 0.4162913686952922, 'colsample_bytree': 0.5450766797439928}. Best is trial 17 with value: 0.7206969911863033.[0m
2209.1s 132 [11:05:14] WARNING: ../src/learner.cc:576:
2209.1s 133 Parameters: { "colsample_bytree", "max_depth", "subsample" } might not be used.
2209.1s 134 
2209.1s 135 This could be a false alarm, with some parameters getting used by language bindings but
2209.1s 136 then being mistakenly passed down to XGBoost core, or some parameter actually being used
2209.1s 137 but getting flagged wrongly here. Please open an issue if you find any such cases.
2209.1s 138 
2209.1s 139 
2209.7s 140 [32m[I 2022-01-31 11:05:15,616][0m Trial 30 finished with value: 0.7071218721507445 and parameters: {'booster': 'dart', 'learning_rate': 0.01912673817906147, 'max_depth': 10, 'subsample': 0.9343445634142395, 'colsample_bytree': 0.48014022581935434}. Best is trial 17 with value: 0.7206969911863033.[0m
2210.5s 141 [32m[I 2022-01-31 11:05:16,487][0m Trial 31 finished with value: 0.709755850471077 and parameters: {'booster': 'dart', 'learning_rate': 0.04061566621738802, 'max_depth': 9, 'subsample': 0.615429582304537, 'colsample_bytree': 0.8915686584199282}. Best is trial 17 with value: 0.7206969911863033.[0m
2211.5s 142 [32m[I 2022-01-31 11:05:17,426][0m Trial 32 finished with value: 0.7201904568939318 and parameters: {'booster': 'dart', 'learning_rate': 0.04873925601945696, 'max_depth': 10, 'subsample': 0.5493297061081676, 'colsample_bytree': 0.8329968201713971}. Best is trial 17 with value: 0.7206969911863033.[0m
2212.2s 143 [32m[I 2022-01-31 11:05:18,163][0m Trial 33 finished with value: 0.7063114172829501 and parameters: {'booster': 'dart', 'learning_rate': 0.026991600290648347, 'max_depth': 10, 'subsample': 0.3276061340666187, 'colsample_bytree': 0.6421144086125987}. Best is trial 17 with value: 0.7206969911863033.[0m
2212.3s 144 [32m[I 2022-01-31 11:05:18,276][0m Trial 34 finished with value: 0.6944585148414548 and parameters: {'booster': 'gblinear', 'learning_rate': 0.036492161312323, 'max_depth': 11, 'subsample': 0.4943939247878598, 'colsample_bytree': 0.83792116129599}. Best is trial 17 with value: 0.7206969911863033.[0m
2212.4s 145 [11:05:18] WARNING: ../src/learner.cc:576:
2212.4s 146 Parameters: { "colsample_bytree", "max_depth", "subsample" } might not be used.
2212.4s 147 
2212.4s 148 This could be a false alarm, with some parameters getting used by language bindings but
2212.4s 149 then being mistakenly passed down to XGBoost core, or some parameter actually being used
2212.4s 150 but getting flagged wrongly here. Please open an issue if you find any such cases.
2212.4s 151 
2212.4s 152 
2212.6s 153 [32m[I 2022-01-31 11:05:18,507][0m Trial 35 finished with value: 0.6945598216999291 and parameters: {'booster': 'dart', 'learning_rate': 0.0630717971002627, 'max_depth': 11, 'subsample': 0.5525017564941934, 'colsample_bytree': 0.0270030702240025}. Best is trial 17 with value: 0.7206969911863033.[0m
2213.2s 154 [32m[I 2022-01-31 11:05:19,167][0m Trial 36 finished with value: 0.70185391551008 and parameters: {'booster': 'dart', 'learning_rate': 0.04852125708752863, 'max_depth': 10, 'subsample': 0.19096408218291827, 'colsample_bytree': 0.7155390526130652}. Best is trial 17 with value: 0.7206969911863033.[0m
2214.1s 155 [32m[I 2022-01-31 11:05:20,066][0m Trial 37 finished with value: 0.7178603991490224 and parameters: {'booster': 'gbtree', 'learning_rate': 0.018066133888692007, 'max_depth': 10, 'subsample': 0.4561796207656936, 'colsample_bytree': 0.8194615050180554}. Best is trial 17 with value: 0.7206969911863033.[0m
2214.7s 156 [32m[I 2022-01-31 11:05:20,635][0m Trial 38 finished with value: 0.7041839732549894 and parameters: {'booster': 'dart', 'learning_rate': 0.03710222359152974, 'max_depth': 6, 'subsample': 0.6643441823110123, 'colsample_bytree': 0.9228358286759645}. Best is trial 17 with value: 0.7206969911863033.[0m
2214.8s 157 [32m[I 2022-01-31 11:05:20,753][0m Trial 39 finished with value: 0.6946611285584035 and parameters: {'booster': 'gblinear', 'learning_rate': 0.028166995702770876, 'max_depth': 11, 'subsample': 0.7581166223831488, 'colsample_bytree': 0.7410904896789124}. Best is trial 17 with value: 0.7206969911863033.[0m
2214.9s 158 [11:05:20] WARNING: ../src/learner.cc:576:
2214.9s 159 Parameters: { "colsample_bytree", "max_depth", "subsample" } might not be used.
2214.9s 160 
2214.9s 161 This could be a false alarm, with some parameters getting used by language bindings but
2214.9s 162 then being mistakenly passed down to XGBoost core, or some parameter actually being used
2214.9s 163 but getting flagged wrongly here. Please open an issue if you find any such cases.
2214.9s 164 
2214.9s 165 
