2215.2s 166 [32m[I 2022-01-31 11:05:21,186][0m Trial 40 finished with value: 0.7034748252456692 and parameters: {'booster': 'gbtree', 'learning_rate': 0.08000320568482239, 'max_depth': 9, 'subsample': 0.17518450368122807, 'colsample_bytree': 0.5744068008244952}. Best is trial 17 with value: 0.7206969911863033.[0m
2216.2s 167 [32m[I 2022-01-31 11:05:22,160][0m Trial 41 finished with value: 0.7156316482625875 and parameters: {'booster': 'dart', 'learning_rate': 0.04313183687219272, 'max_depth': 10, 'subsample': 0.623561539358722, 'colsample_bytree': 0.8667464199109375}. Best is trial 17 with value: 0.7206969911863033.[0m
2217.2s 168 [32m[I 2022-01-31 11:05:23,170][0m Trial 42 finished with value: 0.7149225002532672 and parameters: {'booster': 'dart', 'learning_rate': 0.05125533613790296, 'max_depth': 10, 'subsample': 0.6578473720661374, 'colsample_bytree': 0.9376347367446668}. Best is trial 17 with value: 0.7206969911863033.[0m
2218.0s 169 [32m[I 2022-01-31 11:05:23,956][0m Trial 43 finished with value: 0.7147198865363185 and parameters: {'booster': 'dart', 'learning_rate': 0.043193725156717974, 'max_depth': 9, 'subsample': 0.5366190480168521, 'colsample_bytree': 0.7567074371044668}. Best is trial 17 with value: 0.7206969911863033.[0m
2218.6s 170 [32m[I 2022-01-31 11:05:24,581][0m Trial 44 finished with value: 0.7084388613109107 and parameters: {'booster': 'dart', 'learning_rate': 0.05960040677312213, 'max_depth': 8, 'subsample': 0.4450257769686422, 'colsample_bytree': 0.6653387577518101}. Best is trial 17 with value: 0.7206969911863033.[0m
2219.1s 171 [32m[I 2022-01-31 11:05:25,001][0m Trial 45 finished with value: 0.6995238577651707 and parameters: {'booster': 'dart', 'learning_rate': 0.035828634096988284, 'max_depth': 11, 'subsample': 0.7624603656867485, 'colsample_bytree': 0.1661715539820835}. Best is trial 17 with value: 0.7206969911863033.[0m
2220.3s 172 [32m[I 2022-01-31 11:05:25,998][0m Trial 46 finished with value: 0.7203930706108804 and parameters: {'booster': 'gbtree', 'learning_rate': 0.05269784633334885, 'max_depth': 11, 'subsample': 0.5019395069065496, 'colsample_bytree': 0.8164528561958428}. Best is trial 17 with value: 0.7206969911863033.[0m
2221.2s 173 [32m[I 2022-01-31 11:05:27,144][0m Trial 47 finished with value: 0.7198865363185086 and parameters: {'booster': 'gbtree', 'learning_rate': 0.06723373158071531, 'max_depth': 11, 'subsample': 0.5150644821421985, 'colsample_bytree': 0.8046859770100563}. Best is trial 17 with value: 0.7206969911863033.[0m
2222.1s 174 [32m[I 2022-01-31 11:05:28,050][0m Trial 48 finished with value: 0.7156316482625875 and parameters: {'booster': 'gbtree', 'learning_rate': 0.0670772643561551, 'max_depth': 11, 'subsample': 0.3736966071425244, 'colsample_bytree': 0.7834206942892823}. Best is trial 17 with value: 0.7206969911863033.[0m
2223.1s 175 [32m[I 2022-01-31 11:05:29,047][0m Trial 49 finished with value: 0.7185695471583426 and parameters: {'booster': 'gbtree', 'learning_rate': 0.07852194663256937, 'max_depth': 10, 'subsample': 0.5119101981062375, 'colsample_bytree': 0.9963934025658903}. Best is trial 17 with value: 0.7206969911863033.[0m
2224.1s 176 [32m[I 2022-01-31 11:05:30,059][0m Trial 50 finished with value: 0.7166447168473306 and parameters: {'booster': 'gbtree', 'learning_rate': 0.05356710905756013, 'max_depth': 11, 'subsample': 0.5772289475922693, 'colsample_bytree': 0.8127132811638351}. Best is trial 17 with value: 0.7206969911863033.[0m
2225.2s 177 [32m[I 2022-01-31 11:05:31,159][0m Trial 51 finished with value: 0.7170499442812277 and parameters: {'booster': 'gbtree', 'learning_rate': 0.0621341831245494, 'max_depth': 11, 'subsample': 0.4947130305711598, 'colsample_bytree': 0.8527007040081376}. Best is trial 17 with value: 0.7206969911863033.[0m
2226.0s 178 [32m[I 2022-01-31 11:05:31,982][0m Trial 52 finished with value: 0.7207982980447776 and parameters: {'booster': 'gbtree', 'learning_rate': 0.05236111905431891, 'max_depth': 11, 'subsample': 0.9011045747297194, 'colsample_bytree': 0.623621137018364}. Best is trial 52 with value: 0.7207982980447776.[0m
2226.9s 179 [32m[I 2022-01-31 11:05:32,812][0m Trial 53 finished with value: 0.7190760814507142 and parameters: {'booster': 'gbtree', 'learning_rate': 0.053036177124344795, 'max_depth': 11, 'subsample': 0.9234836481970671, 'colsample_bytree': 0.6149592541014776}. Best is trial 52 with value: 0.7207982980447776.[0m
2228.8s 180 [32m[I 2022-01-31 11:05:34,713][0m Trial 54 finished with value: 0.7164421031303819 and parameters: {'booster': 'gbtree', 'learning_rate': 0.040534583630001675, 'max_depth': 10, 'subsample': 0.38713417711065523, 'colsample_bytree': 0.9183224242568115}. Best is trial 52 with value: 0.7207982980447776.[0m
2229.6s 181 [32m[I 2022-01-31 11:05:35,513][0m Trial 55 finished with value: 0.7144159659608955 and parameters: {'booster': 'gbtree', 'learning_rate': 0.07741770496572675, 'max_depth': 10, 'subsample': 0.5671996655171823, 'colsample_bytree': 0.7483175946195321}. Best is trial 52 with value: 0.7207982980447776.[0m
2230.6s 182 [32m[I 2022-01-31 11:05:36,507][0m Trial 56 finished with value: 0.7208996049032521 and parameters: {'booster': 'gbtree', 'learning_rate': 0.08719954282461731, 'max_depth': 11, 'subsample': 0.9700753572865582, 'colsample_bytree': 0.795495654475716}. Best is trial 56 with value: 0.7208996049032521.[0m
2231.4s 183 [32m[I 2022-01-31 11:05:37,340][0m Trial 57 finished with value: 0.7211022186202006 and parameters: {'booster': 'gbtree', 'learning_rate': 0.0865739455645002, 'max_depth': 11, 'subsample': 0.9730474079206893, 'colsample_bytree': 0.6339178438247024}. Best is trial 57 with value: 0.7211022186202006.[0m
2231.6s 184 [32m[I 2022-01-31 11:05:37,546][0m Trial 58 finished with value: 0.6987134028973762 and parameters: {'booster': 'gbtree', 'learning_rate': 0.08985606708863259, 'max_depth': 3, 'subsample': 0.9670476184901198, 'colsample_bytree': 0.5217694029766098}. Best is trial 57 with value: 0.7211022186202006.[0m
2231.9s 185 [32m[I 2022-01-31 11:05:37,849][0m Trial 59 finished with value: 0.7004356194914396 and parameters: {'booster': 'gbtree', 'learning_rate': 0.0937572522599996, 'max_depth': 4, 'subsample': 0.8915417891246717, 'colsample_bytree': 0.6620020585873891}. Best is trial 57 with value: 0.7211022186202006.[0m
2232.7s 186 [32m[I 2022-01-31 11:05:38,628][0m Trial 60 finished with value: 0.7193800020261372 and parameters: {'booster': 'gbtree', 'learning_rate': 0.08394340042057384, 'max_depth': 11, 'subsample': 0.9659399073375228, 'colsample_bytree': 0.5702614821942092}. Best is trial 57 with value: 0.7211022186202006.[0m
2233.5s 187 [32m[I 2022-01-31 11:05:39,437][0m Trial 61 finished with value: 0.7210009117617263 and parameters: {'booster': 'gbtree', 'learning_rate': 0.047111525834128865, 'max_depth': 11, 'subsample': 0.8956998625838264, 'colsample_bytree': 0.5985372677720507}. Best is trial 57 with value: 0.7211022186202006.[0m
2234.4s 188 [32m[I 2022-01-31 11:05:40,314][0m Trial 62 finished with value: 0.7210009117617263 and parameters: {'booster': 'gbtree', 'learning_rate': 0.07210351173557883, 'max_depth': 11, 'subsample': 0.8937839381121532, 'colsample_bytree': 0.634443832026897}. Best is trial 57 with value: 0.7211022186202006.[0m
2235.2s 189 [32m[I 2022-01-31 11:05:41,151][0m Trial 63 finished with value: 0.7173538648566508 and parameters: {'booster': 'gbtree', 'learning_rate': 0.07404690258107771, 'max_depth': 11, 'subsample': 0.8898749298347461, 'colsample_bytree': 0.6085974356515067}. Best is trial 57 with value: 0.7211022186202006.[0m
2236.0s 190 [32m[I 2022-01-31 11:05:41,905][0m Trial 64 finished with value: 0.7137068179515752 and parameters: {'booster': 'gbtree', 'learning_rate': 0.08374098039442816, 'max_depth': 11, 'subsample': 0.9908056936236556, 'colsample_bytree': 0.4874596251144415}. Best is trial 57 with value: 0.7211022186202006.[0m
2236.6s 191 [32m[I 2022-01-31 11:05:42,554][0m Trial 65 finished with value: 0.7137068179515752 and parameters: {'booster': 'gbtree', 'learning_rate': 0.09962299470246631, 'max_depth': 11, 'subsample': 0.848479190185186, 'colsample_bytree': 0.38995642127815766}. Best is trial 57 with value: 0.7211022186202006.[0m
2237.5s 192 [32m[I 2022-01-31 11:05:43,449][0m Trial 66 finished with value: 0.718366933441394 and parameters: {'booster': 'gbtree', 'learning_rate': 0.07046249349122494, 'max_depth': 11, 'subsample': 0.9140007365480485, 'colsample_bytree': 0.6414605782284365}. Best is trial 57 with value: 0.7211022186202006.[0m
2238.2s 193 [32m[I 2022-01-31 11:05:44,193][0m Trial 67 finished with value: 0.7163407962719076 and parameters: {'booster': 'gbtree', 'learning_rate': 0.024555219105970593, 'max_depth': 10, 'subsample': 0.9498921508459043, 'colsample_bytree': 0.5971636053694116}. Best is trial 57 with value: 0.7211022186202006.[0m
2238.9s 194 [32m[I 2022-01-31 11:05:44,882][0m Trial 68 finished with value: 0.712997669942255 and parameters: {'booster': 'gbtree', 'learning_rate': 0.08842321300567074, 'max_depth': 10, 'subsample': 0.790317723058501, 'colsample_bytree': 0.5480148664305463}. Best is trial 57 with value: 0.7211022186202006.[0m
2239.9s 195 [32m[I 2022-01-31 11:05:45,806][0m Trial 69 finished with value: 0.7213048323371493 and parameters: {'booster': 'gbtree', 'learning_rate': 0.0571412073620355, 'max_depth': 11, 'subsample': 0.8783517922700326, 'colsample_bytree': 0.6848210357646551}. Best is trial 69 with value: 0.7213048323371493.[0m
2240.6s 196 [32m[I 2022-01-31 11:05:46,591][0m Trial 70 finished with value: 0.7179617060074968 and parameters: {'booster': 'gbtree', 'learning_rate': 0.06110383461733293, 'max_depth': 10, 'subsample': 0.8780966395618847, 'colsample_bytree': 0.6850541203874241}. Best is trial 69 with value: 0.7213048323371493.[0m
2240.8s 197 [32m[I 2022-01-31 11:05:46,788][0m Trial 71 finished with value: 0.6173639955424982 and parameters: {'booster': 'gbtree', 'learning_rate': 0.05473724841276219, 'max_depth': 11, 'subsample': 0.0007823874061420599, 'colsample_bytree': 0.62684047574119}. Best is trial 69 with value: 0.7213048323371493.[0m
2241.8s 198 [32m[I 2022-01-31 11:05:47,708][0m Trial 72 finished with value: 0.7213048323371493 and parameters: {'booster': 'gbtree', 'learning_rate': 0.05839167946539654, 'max_depth': 11, 'subsample': 0.9077703113508191, 'colsample_bytree': 0.7158588353030693}. Best is trial 69 with value: 0.7213048323371493.[0m
2242.7s 199 [32m[I 2022-01-31 11:05:48,659][0m Trial 73 finished with value: 0.7176577854320737 and parameters: {'booster': 'gbtree', 'learning_rate': 0.05785164135756126, 'max_depth': 11, 'subsample': 0.9094858236105166, 'colsample_bytree': 0.7288867088815729}. Best is trial 69 with value: 0.7213048323371493.[0m
2243.6s 200 [32m[I 2022-01-31 11:05:49,510][0m Trial 74 finished with value: 0.7160368756964847 and parameters: {'booster': 'gbtree', 'learning_rate': 0.06425921942852414, 'max_depth': 11, 'subsample': 0.8411451986605515, 'colsample_bytree': 0.6595891770789174}. Best is trial 69 with value: 0.7213048323371493.[0m
2244.0s 201 [32m[I 2022-01-31 11:05:49,921][0m Trial 75 finished with value: 0.7096545436126026 and parameters: {'booster': 'gbtree', 'learning_rate': 0.07593639620583992, 'max_depth': 6, 'subsample': 0.9537043674362095, 'colsample_bytree': 0.693182047380728}. Best is trial 69 with value: 0.7213048323371493.[0m
2244.7s 202 [32m[I 2022-01-31 11:05:50,603][0m Trial 76 finished with value: 0.7141120453854726 and parameters: {'booster': 'gbtree', 'learning_rate': 0.011090825289423989, 'max_depth': 10, 'subsample': 0.7979481268205697, 'colsample_bytree': 0.5801486415681543}. Best is trial 69 with value: 0.7213048323371493.[0m
2244.8s 203 [32m[I 2022-01-31 11:05:50,720][0m Trial 77 finished with value: 0.6941545942660318 and parameters: {'booster': 'gblinear', 'learning_rate': 0.0460779800444349, 'max_depth': 7, 'subsample': 0.863604973643218, 'colsample_bytree': 0.7215154163441975}. Best is trial 69 with value: 0.7213048323371493.[0m
2244.9s 204 [11:05:50] WARNING: ../src/learner.cc:576:
2244.9s 205 Parameters: { "colsample_bytree", "max_depth", "subsample" } might not be used.
2244.9s 206 
2244.9s 207 This could be a false alarm, with some parameters getting used by language bindings but
2244.9s 208 then being mistakenly passed down to XGBoost core, or some parameter actually being used
2244.9s 209 but getting flagged wrongly here. Please open an issue if you find any such cases.
2244.9s 210 
2244.9s 211 
2245.5s 212 [32m[I 2022-01-31 11:05:51,466][0m Trial 78 finished with value: 0.7149225002532672 and parameters: {'booster': 'gbtree', 'learning_rate': 0.0329087993355818, 'max_depth': 11, 'subsample': 0.8991592472409004, 'colsample_bytree': 0.5140146491900124}. Best is trial 69 with value: 0.7213048323371493.[0m
2246.5s 213 [32m[I 2022-01-31 11:05:52,427][0m Trial 79 finished with value: 0.7222165940634181 and parameters: {'booster': 'gbtree', 'learning_rate': 0.0933017573368788, 'max_depth': 11, 'subsample': 0.9958276772154104, 'colsample_bytree': 0.7692656268007138}. Best is trial 79 with value: 0.7222165940634181.[0m
2247.4s 214 [32m[I 2022-01-31 11:05:53,347][0m Trial 80 finished with value: 0.7213048323371493 and parameters: {'booster': 'gbtree', 'learning_rate': 0.09410023775042047, 'max_depth': 10, 'subsample': 0.9929453056522911, 'colsample_bytree': 0.7750673036528273}. Best is trial 79 with value: 0.7222165940634181.[0m
2248.4s 215 [32m[I 2022-01-31 11:05:54,326][0m Trial 81 finished with value: 0.7226218214973154 and parameters: {'booster': 'gbtree', 'learning_rate': 0.0836269678935918, 'max_depth': 11, 'subsample': 0.9911641563104077, 'colsample_bytree': 0.7889774708091468}. Best is trial 81 with value: 0.7226218214973154.[0m
2249.3s 216 [32m[I 2022-01-31 11:05:55,280][0m Trial 82 finished with value: 0.7215074460540979 and parameters: {'booster': 'gbtree', 'learning_rate': 0.09137417863268918, 'max_depth': 11, 'subsample': 0.997132417005611, 'colsample_bytree': 0.7736161072206927}. Best is trial 81 with value: 0.7226218214973154.[0m
2250.2s 217 [32m[I 2022-01-31 11:05:56,105][0m Trial 83 finished with value: 0.720291763752406 and parameters: {'booster': 'gbtree', 'learning_rate': 0.09458960634048466, 'max_depth': 10, 'subsample': 0.9392509823512177, 'colsample_bytree': 0.7683376033376282}. Best is trial 81 with value: 0.7226218214973154.[0m
2251.3s 218 [32m[I 2022-01-31 11:05:57,004][0m Trial 84 finished with value: 0.7195826157430858 and parameters: {'booster': 'gbtree', 'learning_rate': 0.08280006869952324, 'max_depth': 11, 'subsample': 0.9923528943450075, 'colsample_bytree': 0.6793616245635177}. Best is trial 81 with value: 0.7226218214973154.[0m
2252.3s 219 [32m[I 2022-01-31 11:05:58,212][0m Trial 85 finished with value: 0.7248505723837504 and parameters: {'booster': 'gbtree', 'learning_rate': 0.09296221856044858, 'max_depth': 11, 'subsample': 0.9891573054917479, 'colsample_bytree': 0.7672780534497126}. Best is trial 85 with value: 0.7248505723837504.[0m
2253.1s 220 [32m[I 2022-01-31 11:05:59,060][0m Trial 86 finished with value: 0.7200891500354574 and parameters: {'booster': 'gbtree', 'learning_rate': 0.0953899380170883, 'max_depth': 10, 'subsample': 0.9943260596366448, 'colsample_bytree': 0.7631830517135623}. Best is trial 85 with value: 0.7248505723837504.[0m
2254.0s 221 [32m[I 2022-01-31 11:05:59,972][0m Trial 87 finished with value: 0.7218113666295208 and parameters: {'booster': 'gbtree', 'learning_rate': 0.09194895523374579, 'max_depth': 11, 'subsample': 0.9319109906876442, 'colsample_bytree': 0.7145321180228247}. Best is trial 85 with value: 0.7248505723837504.[0m
2254.8s 222 [32m[I 2022-01-31 11:06:00,751][0m Trial 88 finished with value: 0.7206969911863033 and parameters: {'booster': 'gbtree', 'learning_rate': 0.09203161529037289, 'max_depth': 10, 'subsample': 0.9355820169135278, 'colsample_bytree': 0.7197664709397599}. Best is trial 85 with value: 0.7248505723837504.[0m
2255.8s 223 [32m[I 2022-01-31 11:06:01,733][0m Trial 89 finished with value: 0.7227231283557897 and parameters: {'booster': 'gbtree', 'learning_rate': 0.09931452087286619, 'max_depth': 11, 'subsample': 0.9671666127658701, 'colsample_bytree': 0.7804039155423445}. Best is trial 85 with value: 0.7248505723837504.[0m
2255.9s 224 [32m[I 2022-01-31 11:06:01,848][0m Trial 90 finished with value: 0.6787559517779354 and parameters: {'booster': 'gblinear', 'learning_rate': 0.09984613179055275, 'max_depth': 8, 'subsample': 0.9959566513157672, 'colsample_bytree': 0.7759933399079222}. Best is trial 85 with value: 0.7248505723837504.[0m
2256.0s 225 [11:06:01] WARNING: ../src/learner.cc:576:
2256.0s 226 Parameters: { "colsample_bytree", "max_depth", "subsample" } might not be used.
2256.0s 227 
2256.0s 228 This could be a false alarm, with some parameters getting used by language bindings but
2256.0s 229 then being mistakenly passed down to XGBoost core, or some parameter actually being used
2256.0s 230 but getting flagged wrongly here. Please open an issue if you find any such cases.
2256.0s 231 
2256.0s 232 
2256.8s 233 [32m[I 2022-01-31 11:06:02,783][0m Trial 91 finished with value: 0.7198865363185086 and parameters: {'booster': 'gbtree', 'learning_rate': 0.08199350951653585, 'max_depth': 11, 'subsample': 0.9694377383289402, 'colsample_bytree': 0.7471152841040974}. Best is trial 85 with value: 0.7248505723837504.[0m
2257.9s 234 [32m[I 2022-01-31 11:06:03,830][0m Trial 92 finished with value: 0.7174551717151251 and parameters: {'booster': 'gbtree', 'learning_rate': 0.08819458795650907, 'max_depth': 11, 'subsample': 0.9504737028827247, 'colsample_bytree': 0.8404451263581422}. Best is trial 85 with value: 0.7248505723837504.[0m
2258.9s 235 [32m[I 2022-01-31 11:06:04,847][0m Trial 93 finished with value: 0.718366933441394 and parameters: {'booster': 'gbtree', 'learning_rate': 0.09163549448880967, 'max_depth': 11, 'subsample': 0.927291813763071, 'colsample_bytree': 0.7899805273651472}. Best is trial 85 with value: 0.7248505723837504.[0m
2259.8s 236 [32m[I 2022-01-31 11:06:05,784][0m Trial 94 finished with value: 0.7215074460540979 and parameters: {'booster': 'gbtree', 'learning_rate': 0.08020500358151772, 'max_depth': 11, 'subsample': 0.9708188661136082, 'colsample_bytree': 0.7419513181298201}. Best is trial 85 with value: 0.7248505723837504.[0m
2261.8s 237 [32m[I 2022-01-31 11:06:07,718][0m Trial 95 finished with value: 0.7225205146388409 and parameters: {'booster': 'gbtree', 'learning_rate': 0.08016895551344562, 'max_depth': 11, 'subsample': 0.8710434308311386, 'colsample_bytree': 0.708306724119568}. Best is trial 85 with value: 0.7248505723837504.[0m
2262.7s 238 [32m[I 2022-01-31 11:06:08,650][0m Trial 96 finished with value: 0.7176577854320737 and parameters: {'booster': 'gbtree', 'learning_rate': 0.08068031598625768, 'max_depth': 10, 'subsample': 0.9239033380540097, 'colsample_bytree': 0.872012946097267}. Best is trial 85 with value: 0.7248505723837504.[0m
2263.6s 239 [32m[I 2022-01-31 11:06:09,564][0m Trial 97 finished with value: 0.7195826157430858 and parameters: {'booster': 'gbtree', 'learning_rate': 0.07649779420690452, 'max_depth': 11, 'subsample': 0.9981653934649928, 'colsample_bytree': 0.7115506970278779}. Best is trial 85 with value: 0.7248505723837504.[0m
2264.5s 240 [32m[I 2022-01-31 11:06:10,499][0m Trial 98 finished with value: 0.7207982980447776 and parameters: {'booster': 'gbtree', 'learning_rate': 0.06874730745297981, 'max_depth': 11, 'subsample': 0.8660421872898522, 'colsample_bytree': 0.7454865442955156}. Best is trial 85 with value: 0.7248505723837504.[0m
