2265.6s 241 [32m[I 2022-01-31 11:06:11,514][0m Trial 99 finished with value: 0.7187721608752913 and parameters: {'booster': 'gbtree', 'learning_rate': 0.09571396766849007, 'max_depth': 11, 'subsample': 0.9709444951929214, 'colsample_bytree': 0.8204940105062054}. Best is trial 85 with value: 0.7248505723837504.[0m
2266.1s 242 /opt/conda/lib/python3.7/site-packages/xgboost/sklearn.py:1224: UserWarning: The use of label encoder in XGBClassifier is deprecated and will be removed in a future release. To remove this warning, do the following: 1) Pass option use_label_encoder=False when constructing XGBClassifier object; and 2) Encode your labels (y) as integers starting with 0, i.e. 0, 1, 2, ..., [num_class - 1].
2266.1s 243 warnings.warn(label_encoder_deprecation_msg, UserWarning)
2266.5s 244 [11:06:12] WARNING: ../src/learner.cc:1115: Starting in XGBoost 1.3.0, the default evaluation metric used with the objective 'multi:softprob' was changed from 'merror' to 'mlogloss'. Explicitly set eval_metric if you'd like to restore the old behavior.
2296.9s 245 Optimized SuperLearner accuracy:  0.9279708236247594
2296.9s 246 Optimized SuperLearner f1-score:  0.9279708236247594
2297.3s 247 Number of finished trials:  100
2297.3s 248 Best trial:
2297.3s 249 Value: 0.7248505723837504
2297.3s 250 Params:
2297.3s 251 booster: gbtree
2297.3s 252 learning_rate: 0.09296221856044858
2297.3s 253 max_depth: 11
2297.3s 254 subsample: 0.9891573054917479
2297.3s 255 colsample_bytree: 0.7672780534497126
2297.7s 256 All of accuracies
2297.7s 257 [0.7487653539318728, 0.7418946301925026, 0.7415146909827761, 0.7426545086119554, 0.7387284701114488]
2297.7s 258 Mean of accuracies
2297.7s 259 0.7427115307661111
2303.0s 260 /opt/conda/lib/python3.7/site-packages/traitlets/traitlets.py:2567: FutureWarning: --Exporter.preprocessors=["remove_papermill_header.RemovePapermillHeader"] for containers is deprecated in traitlets 5.0. You can pass `--Exporter.preprocessors item` ... multiple times to add items to a list.
2303.0s 261 FutureWarning,
2303.0s 262 [NbConvertApp] Converting notebook __notebook__.ipynb to notebook
2304.3s 263 [NbConvertApp] Writing 1735845 bytes to __notebook__.ipynb
2307.1s 264 /opt/conda/lib/python3.7/site-packages/traitlets/traitlets.py:2567: FutureWarning: --Exporter.preprocessors=["nbconvert.preprocessors.ExtractOutputPreprocessor"] for containers is deprecated in traitlets 5.0. You can pass `--Exporter.preprocessors item` ... multiple times to add items to a list.
2307.1s 265 FutureWarning,
2307.1s 266 [NbConvertApp] Converting notebook __notebook__.ipynb to html
2309.0s 267 [NbConvertApp] Support files will be in __results___files/
2309.0s 268 [NbConvertApp] Making directory __results___files
2309.0s 269 [NbConvertApp] Making directory __results___files
2309.0s 270 [NbConvertApp] Making directory __results___files
2309.0s 271 [NbConvertApp] Making directory __results___files
2309.0s 272 [NbConvertApp] Making directory __results___files
2309.0s 273 [NbConvertApp] Making directory __results___files
2309.0s 274 [NbConvertApp] Making directory __results___files
2309.0s 275 [NbConvertApp] Making directory __results___files
2309.0s 276 [NbConvertApp] Making directory __results___files
2309.0s 277 [NbConvertApp] Making directory __results___files
2309.0s 278 [NbConvertApp] Making directory __results___files
2309.0s 279 [NbConvertApp] Making directory __results___files
2309.0s 280 [NbConvertApp] Making directory __results___files
2309.0s 281 [NbConvertApp] Making directory __results___files
2309.0s 282 [NbConvertApp] Making directory __results___files
2309.0s 283 [NbConvertApp] Writing 526235 bytes to __results__.html